40401, travian hq, Command Center, Strategy Hall, marcus-sp-A
40402, travian hq, Intelligence Wing, Archives, petra-sp-A
40403, travian hq, Intelligence Wing, Scout Tower, varro-sp-A
40404, travian hq, Economic Wing, Treasury, lucius-sp-A
40405, travian hq, Economic Wing, Construction Yard, gaius-sp-A
40406, travian hq, Economic Wing, Training Grounds, titus-sp-A
40407, travian hq, Operations Wing, Focus Chamber, livia-sp-A
40408, travian hq, Command Center, War Room, felix-sp-A
40409, travian hq, Operations Wing, Logic Lab, quintus-sp-A
